[
  {
    "name": "Python Docs",
    "url": "https://docs.python.org/3/",
    "category": "Reference",
    "tags": [
      "python",
      "reference"
    ],
    "license": "PSF"
  },
  {
    "name": "FastAPI",
    "url": "https://github.com/tiangolo/fastapi",
    "category": "Framework",
    "tags": [
      "python",
      "web"
    ],
    "license": "MIT",
    "api_type": "REST",
    "stars": 87420
  },
  {
    "name": "Rust Book",
    "url": "https://doc.rust-lang.org/book/",
    "category": "Learning",
    "tags": [
      "rust",
      "learning"
    ],
    "license": "MIT"
  },
  {
    "name": "Docker Documentation",
    "url": "https://docs.docker.com/",
    "category": "DevOps",
    "tags": [
      "docker",
      "devops"
    ],
    "license": "Apache-2.0"
  }
]
